candidate_id,requirement,evidence_status,evidence_source,risk_level,blocker,next_action,audit_status
GSE137029,study-level SLE and healthy-control context,verified,"GEO audit and GEO source https://www.ncbi.nlm.nih.gov/geo/query/acc.cgi?acc=GSE137029",low,false,Retain the source-level case-control description,candidate_verification_reviewed
GSE137029,exact diagnosis label field and observed values,blocked,"Existing audit records disease labels as visible but does not record exact patient/sample fields",high,true,Inspect approved metadata files and record exact field names values definitions and source locations,candidate_verification_pending
GSE137029,patient or donor linkage to diagnosis label,blocked,reports/tables/geo_candidate_datasets.csv,critical,true,Verify every candidate training unit maps to one explicit diagnosis or control label,candidate_verification_pending
GSE137029,disease activity label provenance,unclear,"GEO summary mentions active flares but patient/sample-level availability is unresolved",high,true,Keep activity prediction blocked and do not infer activity labels,candidate_verification_pending
CELLxGENE_HCA_436154da-bcf1-4130-9c8b-120ff9a888f2_218acb0f-9f2f-4f76-b90b-15a4b7c7f629,normal and SLE disease terms visible,verified,"https://cellxgene.cziscience.com/collections/436154da-bcf1-4130-9c8b-120ff9a888f2; reports/tables/cellxgene_candidate_datasets.csv",low,false,Preserve original ontology terms and source provenance,candidate_verification_reviewed
CELLxGENE_HCA_436154da-bcf1-4130-9c8b-120ff9a888f2_218acb0f-9f2f-4f76-b90b-15a4b7c7f629,exact patient-level diagnosis label provenance,blocked,"Existing audit does not document donor-to-disease field linkage",high,true,Record source field values ontology mapping donor linkage and missingness before any target construction,candidate_verification_pending
CELLxGENE_HCA_436154da-bcf1-4130-9c8b-120ff9a888f2_218acb0f-9f2f-4f76-b90b-15a4b7c7f629,control definition and class counts after donor linkage,pending,"CELLxGENE metadata records normal and SLE terms but linked training counts are not audited",high,true,Verify comparator definition unique donor counts and excluded or missing labels,candidate_verification_pending
CELLxGENE_HCA_436154da-bcf1-4130-9c8b-120ff9a888f2_218acb0f-9f2f-4f76-b90b-15a4b7c7f629,disease activity label provenance,unclear,reports/tables/cellxgene_candidate_datasets.csv,high,true,Keep activity prediction blocked unless explicit activity fields and provenance are later documented,candidate_verification_pending
